completionCode,trialNum,itemNum,condition,Value,sentence,conj1,conj2,ratingRT,is_sa,rating,suffix
CO391648,17,4,X-and-Y-ci,iyi,Burak tatlı için limon ve portakalcı bir satıcıdan sipariş vermiş.,limon,portakal,8390,1,5,-cI
CO391648,20,26,X-and-Y-li,oldukça iyi,Sinan gece yarısı hayalet ve canavarlı bir hikâye okudu.,hayalet,canavar,4278,1,6,-lI
CO391648,23,2,X-and-Y-li,oldukça iyi,Ömer yeni evine masa ve sandalyeli bir yemek odası kurdu.,masa,sandalye,5549,1,6,-lI
CO391648,26,16,X-and-Y-siz,iyi sayılır,Okan üniversite yıllarında çiftlik ve fabrikasız bir iş modeli önerdi.,çiftlik,fabrika,6854,1,4,-sIz
CO391648,29,1,X-li-and-Y-li,iyi sayılır,Emel geçen haftasonu çoraplı ve ayakkabılı bir takım aldı.,çorap,ayakkabı,5344,0,4,-lI
CO391648,32,24,X-and-Y-siz,oldukça iyi,Neval ders çalışırken göz ve kulaksız bir heykel çizdi.,göz,kulak,4161,1,6,-sIz
CO391648,35,17,X-li-and-Y-li,oldukça iyi,Eylül kamp yaparken tepeli ve nehirli bir alan seçti.,tepe,nehir,4061,0,6,-lI
CO391648,38,12,X-and-Y-ci,iyi sayılır,Merve yeni villası için ev ve bahçeci bir peyzaj tasarımcısıyla anlaştı.,ev,bahçe,5781,1,4,-cI
CO391648,41,28,X-and-Y-ci,iyi sayılır,Yasemin mezuniyetinden önce doktor ve avukatçı bir derneğe katıldı.,avukat,doktor,5370,1,4,-cI
CO391648,44,3,X-ci-and-Y-ci,iyi sayılır,Leyla eski çarşıda atkıcı ve şapkacı bir tuhafiyeye uğrayacakmış.,atkı,şapka,5336,0,4,-cI
CO391648,47,29,X-lik-and-Y-lik,iyi,Melis çocuk kitabı için ejderhalık ve perilik bir seri başlatmayı düşündü.,ejderha,peri,5616,0,5,-lIk
CO391648,50,7,X-siz-and-Y-siz,oldukça iyi,Dilek çeyiz alşverişi için battaniyesiz ve halısız bir paket seçmiş.,battaniye,halı,4346,0,6,-sIz
CO391648,53,10,X-and-Y-li,iyi sayılır,Ali geçen ay kedi ve köpekli bir veteriner kliniği açtı.,kedi,köpek,7311,1,4,-lI
CO391648,56,25,X-li-and-Y-li,iyi,İzel toplantı sırasında burunlu ve boyunlu bir maske inceledi.,burun,boyun,4952,0,5,-lI
CO391648,59,18,X-and-Y-li,kötü,Nevzat genç bir stajyerken okul ve camili bir mahallede oturdu.,okul,cami,5832,1,2,-lI
CO391648,62,32,X-and-Y-siz,kötü,Aydan restorasyon projesi için taban ve tavansız bir oda düşündü.,taban,tavan,6730,1,2,-sIz
CO391648,65,31,X-siz-and-Y-siz,oldukça iyi,Tülay sonbahar koleksiyonu için gömleksiz ve pantolonsuz bir katalog inceledi.,gömlek,pantolon,5586,0,6,-sIz
CO391648,68,6,X-and-Y-lik,iyi,Ali diyetteyken muz ve havuçluk bir saklama kabı almıştı.,muz,havuç,5319,1,5,-lIk
CO391648,71,22,X-and-Y-lik,oldukça kötü,Yankı geçen yaz at ve balıklık bir hayvanay bahçesi yaptırdı.,at,balık,5175,1,1,-lIk
CO391648,74,15,X-siz-and-Y-siz,iyi sayılır,Deniz misafir beklerken sürahisiz ve bardaksız bir sofra kurdu.,sürahi,bardak,4672,0,4,-sIz
CO391648,77,14,X-and-Y-lik,iyi sayılır,Elif takım oyununda fare ve aslanlık bir sembol seçti.,fare,aslan,4737,1,4,-lIk
CO391648,80,19,X-ci-and-Y-ci,iyi sayılır,Zühre son yolculukta gececi ve gündüzcü bir rehberle tanıştı.,gece,gündüz,5195,0,4,-cI
CO391648,83,20,X-and-Y-ci,iyi sayılır,Fehime düğünden önce büyükanne ve dedeci bir gelenek hakkında yazı okudu.,büyükanne,dede,7474,1,4,-cI
CO391648,86,11,X-ci-and-Y-ci,iyi sayılır,Ahmet yabancı bir üniversitede bilimci ve teknolojici bir araştırmaya katıldı.,bilim,teknoloji,4898,0,4,-cI
CO391648,89,23,X-siz-and-Y-siz,iyi sayılır,Jale geçen hafta çatalsız ve bıçaksız bir piknik yaptı.,çatal,bıçak,4354,0,4,-sIz
CO391648,92,8,X-and-Y-siz,kötü sayılır,Selin tamir için kapı ve penceresiz bir atölye tasarlamış.,kapı,pencere,17061,1,3,-sIz
CO391648,95,21,X-lik-and-Y-lik,kötü sayılır,Mertcan dün akşam abilik ve ablalık bir hediye aldı.,abi,abla,4648,0,3,-lIk
CO705199,3,26,X-and-Y-li,oldukça iyi,Sinan gece yarısı hayalet ve canavarlı bir hikâye okudu.,hayalet,canavar,5844,1,6,-lI
CO705199,6,15,X-siz-and-Y-siz,iyi,Deniz misafir beklerken sürahisiz ve bardaksız bir sofra kurdu.,sürahi,bardak,7130,0,5,-sIz
CO705199,9,25,X-li-and-Y-li,kötü sayılır,İzel toplantı sırasında burunlu ve boyunlu bir maske inceledi.,burun,boyun,10742,0,3,-lI
CO705199,12,28,X-and-Y-ci,kötü,Yasemin mezuniyetinden önce doktor ve avukatçı bir derneğe katıldı.,avukat,doktor,8546,1,2,-cI
CO705199,15,21,X-lik-and-Y-lik,kötü,Mertcan dün akşam abilik ve ablalık bir hediye aldı.,abi,abla,5067,0,2,-lIk
CO705199,18,19,X-ci-and-Y-ci,iyi sayılır,Zühre son yolculukta gececi ve gündüzcü bir rehberle tanıştı.,gece,gündüz,14624,0,4,-cI
CO705199,21,17,X-li-and-Y-li,kötü sayılır,Eylül kamp yaparken tepeli ve nehirli bir alan seçti.,tepe,nehir,9106,0,3,-lI
CO705199,24,2,X-and-Y-li,iyi sayılır,Ömer yeni evine masa ve sandalyeli bir yemek odası kurdu.,masa,sandalye,13838,1,4,-lI
CO705199,27,30,X-and-Y-lik,kötü sayılır,Asuman dergi yazısı için düğün ve cenazelik bir tema belirledi.,cenaze,düğün,10237,1,3,-lIk
CO705199,30,24,X-and-Y-siz,kötü sayılır,Neval ders çalışırken göz ve kulaksız bir heykel çizdi.,göz,kulak,7144,1,3,-sIz
CO705199,33,23,X-siz-and-Y-siz,kötü,Jale geçen hafta çatalsız ve bıçaksız bir piknik yaptı.,çatal,bıçak,8681,0,2,-sIz
CO705199,36,1,X-li-and-Y-li,kötü sayılır,Emel geçen haftasonu çoraplı ve ayakkabılı bir takım aldı.,çorap,ayakkabı,12246,0,3,-lI
CO705199,39,5,X-lik-and-Y-lik,kötü,Ece yılbaşı için tabloluk ve vazoluk bir masa aldı.,tablo,vazo,9047,0,2,-lIk
CO705199,42,8,X-and-Y-siz,oldukça iyi,Selin tamir için kapı ve penceresiz bir atölye tasarlamış.,kapı,pencere,7598,1,6,-sIz
CO705199,45,6,X-and-Y-lik,kötü,Ali diyetteyken muz ve havuçluk bir saklama kabı almıştı.,muz,havuç,10970,1,2,-lIk
CO705199,48,13,X-lik-and-Y-lik,kötü sayılır,Emin geçen tatilde şehirlik ve köylük bir bölgeyi gezdi.,şehir,köy,8678,0,3,-lIk
CO705199,51,16,X-and-Y-siz,oldukça iyi,Okan üniversite yıllarında çiftlik ve fabrikasız bir iş modeli önerdi.,çiftlik,fabrika,6460,1,6,-sIz
CO705199,54,12,X-and-Y-ci,iyi sayılır,Merve yeni villası için ev ve bahçeci bir peyzaj tasarımcısıyla anlaştı.,ev,bahçe,8558,1,4,-cI
CO705199,57,32,X-and-Y-siz,kötü sayılır,Aydan restorasyon projesi için taban ve tavansız bir oda düşündü.,taban,tavan,15865,1,3,-sIz
CO705199,60,4,X-and-Y-ci,kötü sayılır,Burak tatlı için limon ve portakalcı bir satıcıdan sipariş vermiş.,limon,portakal,17501,1,3,-cI
CO705199,63,3,X-ci-and-Y-ci,iyi,Leyla eski çarşıda atkıcı ve şapkacı bir tuhafiyeye uğrayacakmış.,atkı,şapka,9333,0,5,-cI
CO705199,66,20,X-and-Y-ci,oldukça kötü,Fehime düğünden önce büyükanne ve dedeci bir gelenek hakkında yazı okudu.,büyükanne,dede,9574,1,1,-cI
CO705199,69,29,X-lik-and-Y-lik,kötü,Melis çocuk kitabı için ejderhalık ve perilik bir seri başlatmayı düşündü.,ejderha,peri,15248,0,2,-lIk
CO705199,72,18,X-and-Y-li,kötü,Nevzat genç bir stajyerken okul ve camili bir mahallede oturdu.,okul,cami,7784,1,2,-lI
CO705199,75,27,X-ci-and-Y-ci,kötü sayılır,Baran araştırması için ormancı ve çölcü bir araştırmacıyla anlaştı.,orman,çöl,9065,0,3,-cI
CO705199,78,7,X-siz-and-Y-siz,oldukça iyi,Dilek çeyiz alşverişi için battaniyesiz ve halısız bir paket seçmiş.,battaniye,halı,6613,0,6,-sIz
CO705199,81,11,X-ci-and-Y-ci,kötü,Ahmet yabancı bir üniversitede bilimci ve teknolojici bir araştırmaya katıldı.,bilim,teknoloji,12322,0,2,-cI
CO705199,84,31,X-siz-and-Y-siz,iyi,Tülay sonbahar koleksiyonu için gömleksiz ve pantolonsuz bir katalog inceledi.,gömlek,pantolon,9168,0,5,-sIz
CO705199,87,9,X-li-and-Y-li,oldukça kötü,Zeynep bu hafta anneli ve babalı bir toplantıya katıldı.,anne,baba,5470,0,1,-lI
CO705199,90,10,X-and-Y-li,kötü,Ali geçen ay kedi ve köpekli bir veteriner kliniği açtı.,kedi,köpek,8405,1,2,-lI
CO705199,93,22,X-and-Y-lik,oldukça kötü,Yankı geçen yaz at ve balıklık bir hayvanay bahçesi yaptırdı.,at,balık,15427,1,1,-lIk
CO705199,96,14,X-and-Y-lik,kötü sayılır,Elif takım oyununda fare ve aslanlık bir sembol seçti.,fare,aslan,9758,1,3,-lIk
CO312940,3,2,X-and-Y-lik,kötü,Ömer yeni evine masa ve sandalyelik bir renk seçti.,masa,sandalye,6079,1,2,-lIk
CO312940,6,25,X-lik-and-Y-lik,kötü,İzel toplantı sırasında burunluk ve boyunluk bir atkı ördü.,burun,boyun,6363,0,2,-lIk
CO312940,9,30,X-and-Y-li,kötü,Asuman dergi yazısı için düğün ve cenazeli bir belgesel izledi.,cenaze,düğün,4684,1,2,-lI
CO312940,12,20,X-and-Y-siz,kötü sayılır,Fehime düğünden önce büyükanne ve dedesiz bir aile hayatını irdeledi.,büyükanne,dede,11517,1,3,-sIz
CO312940,15,15,X-ci-and-Y-ci,iyi,Deniz misafir beklerken sürahici ve bardakçı bir antikacıdan alışveriş yaptı.,sürahi,bardak,5026,0,5,-cI
CO312940,18,17,X-lik-and-Y-lik,kötü,Eylül kamp yaparken tepelik ve nehirlik bir arazi satın aldı.,tepe,nehir,11428,0,2,-lIk
CO312940,21,32,X-and-Y-ci,iyi,Aydan restorasyon projesi için taban ve tavancı bir ustayla görüştü.,taban,tavan,5395,1,5,-cI
CO312940,24,31,X-ci-and-Y-ci,iyi sayılır,Tülay sonbahar koleksiyonu için gömlekçi ve pantoloncu bir tasarımcıyla tanıştı.,gömlek,pantolon,8723,0,4,-cI
CO312940,27,14,X-and-Y-li,iyi,Elif küçük bir çocukken fare ve aslanlı bir masal dinledi.,fare,aslan,6584,1,5,-lI
CO312940,30,23,X-ci-and-Y-ci,iyi sayılır,Jale geçen hafta çatalcı ve bıçakçı bir esnaftan alışveriş yaptı.,çatal,bıçak,7442,0,4,-cI
CO312940,33,11,X-siz-and-Y-siz,iyi sayılır,Ahmet yabancı bir üniversitede bilimsiz ve teknolojisiz bir düşünceyi eleştirdi.,bilim,teknoloji,7485,0,4,-sIz
CO312940,36,3,X-siz-and-Y-siz,iyi,Leyla eski çarşıda atkısız ve şapkasız bir çocuğa acımış.,atkı,şapka,3487,0,5,-sIz
CO312940,39,6,X-and-Y-li,kötü sayılır,Ali diyetteyken muz ve havuçlu bir kek yapardı.,muz,havuç,9218,1,3,-lI
CO312940,42,5,X-li-and-Y-li,iyi,Ece yılbaşı için tablolu ve vazolu bir masa aldı.,tablo,vazo,5829,0,5,-lI
CO312940,45,26,X-and-Y-lik,kötü,Sinan gece yarısı hayalet ve canavarlık bir sahne tasarladı.,hayalet,canavar,5951,1,2,-lIk
CO312940,48,18,X-and-Y-lik,kötü sayılır,Nevzat genç bir stajyerken okul ve camilik bir alanın korunmasını önerdi.,okul,cami,5804,1,3,-lIk
CO312940,51,9,X-lik-and-Y-lik,kötü,Zeynep yıllar önce annelik ve babalık bir görev üstlendi.,anne,baba,48727,0,2,-lIk
CO312940,54,22,X-and-Y-li,kötü sayılır,Yankı geçen yaz at ve balıklı bir tablo aldı.,at,balık,6987,1,3,-lI
CO312940,57,29,X-li-and-Y-li,iyi sayılır,Melis çocuk kitabı için ejderhalı ve perili bir sahne tasarladı.,ejderha,peri,13052,0,4,-lI
CO312940,60,13,X-li-and-Y-li,oldukça iyi,Emin geçen tatilde şehirli ve köylü bir topluluk projesine katıldı.,şehir,köy,10724,0,6,-lI
CO312940,63,16,X-and-Y-ci,kötü,Okan üniversite yıllarında çiftlik ve fabrikacı bir yatırımcıyla görüştü.,çiftlik,fabrika,14026,1,2,-cI
CO312940,66,19,X-siz-and-Y-siz,kötü,Zühre son yolculukta gecesiz ve gündüzsüz bir tren yolculuğu önerdi.,gece,gündüz,4737,0,2,-sIz
CO312940,69,21,X-li-and-Y-li,kötü sayılır,Mertcan dün akşam abili ve ablalı bir fotoğraf gösterdi.,abi,abla,6538,0,3,-lI
CO312940,72,1,X-lik-and-Y-lik,kötü,Emel geçen haftasonu çoraplık ve ayakkabılık bir dolap aldı.,çorap,ayakkabı,4481,0,2,-lIk
CO312940,75,8,X-and-Y-ci,kötü,Selin tamir için kapı ve pencereci bir marangozla anlaşmış.,kapı,pencere,19043,1,2,-cI
CO312940,78,10,X-and-Y-lik,kötü,Ali yeni firmada kedi ve köpeklik bir tasarım yaptı.,kedi,köpek,5136,1,2,-lIk
CO312940,81,24,X-and-Y-ci,oldukça kötü,Neval ders çalışırken göz ve kulakçı bir doktorla konuştu.,göz,kulak,4647,1,1,-cI
CO312940,84,7,X-ci-and-Y-ci,kötü sayılır,Dilek çeyiz alşverişi için battaniyeci ve halıcı bir züccaciyeciye gidecekmiş.,battaniye,halı,7092,0,3,-cI
CO312940,87,27,X-siz-and-Y-siz,kötü,Baran araştırması için ormansız ve çölsüz bir bölge seçti.,orman,çöl,6625,0,2,-sIz
CO312940,90,4,X-and-Y-siz,kötü,Burak tatlı için limon ve portakalsız bir tarif bulmuş.,limon,portakal,5978,1,2,-sIz
CO312940,93,28,X-and-Y-siz,kötü sayılır,Yasemin mezuniyetinden önce doktor ve avukatsız bir mizansen canlandırdı.,avukat,doktor,4553,1,3,-sIz
CO312940,96,12,X-and-Y-siz,kötü,Merve yeni hayatında ev ve bahçesiz bir şehir hayatı yaşıyor.,ev,bahçe,7642,1,2,-sIz
CO991001,3,12,X-and-Y-li,oldukça kötü,Merve yaz tatilinde ev ve bahçeli bir tatil köyünü ziyaret etti.,ev,bahçe,5242,1,1,-lI
CO991001,6,1,X-siz-and-Y-siz,iyi sayılır,Emel geçen haftasonu çorapsız ve ayakkabısız bir yoga eğitimi aldı.,çorap,ayakkabı,5150,0,4,-sIz
CO991001,9,8,X-and-Y-lik,kötü,Selin tamir için kapı ve pencerelik bir desen seçmiş.,kapı,pencere,9948,1,2,-lIk
CO991001,12,27,X-li-and-Y-li,kötü,Baran araştırması için ormanlı ve çöllü bir harita inceledi.,orman,çöl,39269,0,2,-lI
CO991001,15,20,X-and-Y-li,oldukça kötü,Fehime düğünden önce büyükanne ve dedeli bir aile hayatını irdeledi.,büyükanne,dede,8188,1,1,-lI
CO991001,18,10,X-and-Y-siz,iyi,Ali uzun zamandır kedi ve köpeksiz bir apartmanda yaşıyor.,kedi,köpek,4469,1,5,-sIz
CO991001,21,19,X-li-and-Y-li,iyi,Zühre son yolculukta geceli ve gündüzlü bir seyahat planı hazırladı.,gece,gündüz,9412,0,5,-lI
CO991001,24,26,X-and-Y-siz,kötü,Sinan gece yarısı hayalet ve canavarsız bir film izledi.,hayalet,canavar,3698,1,2,-sIz
CO991001,27,32,X-and-Y-lik,kötü,Aydan restorasyon projesi için taban ve tavanlık bir malzeme seçti.,taban,tavan,7221,1,2,-lIk
CO991001,33,21,X-ci-and-Y-ci,oldukça kötü,Mertcan dün akşam abici ve ablacı bir komşu çocuğuna baktı.,abi,abla,5553,0,1,-cI
CO991001,36,2,X-and-Y-siz,iyi sayılır,Ömer yeni evine masa ve sandalyesiz bir mobilya takımı aldı.,masa,sandalye,8837,1,4,-sIz
CO991001,39,6,X-and-Y-ci,kötü,Ali diyetteyken muz ve havuççu bir tezgahtara uğrardı.,muz,havuç,4969,1,2,-cI
CO991001,42,24,X-and-Y-lik,oldukça kötü,Neval ders çalışırken göz ve kulaklık bir kutu açtı.,göz,kulak,12828,1,1,-lIk
CO991001,45,17,X-siz-and-Y-siz,iyi,Eylül kamp yaparken tepesiz ve nehirsiz bir manzara gördü.,tepe,nehir,4500,0,5,-sIz
CO991001,48,4,X-and-Y-li,iyi sayılır,Burak tatlı için limon ve portakallı bir tarif bulmuş.,limon,portakal,6471,1,4,-lI
CO991001,51,28,X-and-Y-li,iyi sayılır,Yasemin mezuniyetinden önce doktor ve avukatlı bir skeç yazdı.,avukat,doktor,7256,1,4,-lI
CO991001,54,15,X-lik-and-Y-lik,kötü,Deniz misafir beklerken sürahilik ve bardaklık bir raf yaptırdı.,sürahi,bardak,41265,0,2,-lIk
CO991001,57,31,X-lik-and-Y-lik,kötü sayılır,Tülay sonbahar koleksiyonu için gömleklik ve pantolonluk bir kumaş sipariş etti.,gömlek,pantolon,32944,0,3,-lIk
CO991001,63,22,X-and-Y-ci,kötü sayılır,Yankı geçen yaz at ve balıkçı bir işletme sahibiyle tanıştı.,at,balık,9155,1,3,-cI
CO991001,66,7,X-lik-and-Y-lik,kötü,Dilek çeyiz alşverişi için battaniyelik ve halılık bir indirim bulmuş.,battaniye,halı,6383,0,2,-lIk
CO991001,69,9,X-siz-and-Y-siz,iyi sayılır,Zeynep yıllar önce annesiz ve babasız bir çocukluk geçirdi.,anne,baba,6536,0,4,-sIz
CO991001,72,14,X-and-Y-ci,oldukça kötü,Elif gençlik yıllarında fare ve aslancı bir hikaye yazdı.,fare,aslan,42648,1,1,-cI
CO991001,75,11,X-li-and-Y-li,iyi sayılır,Ahmet yabancı bir üniversitede bilimli ve teknolojili bir eğitim sistemi savundu.,bilim,teknoloji,6742,0,4,-lI
CO991001,78,16,X-and-Y-lik,kötü,Okan üniversite yıllarında çiftlik ve fabrikalık bir proje sundu.,çiftlik,fabrika,4906,1,2,-lIk
CO991001,81,25,X-siz-and-Y-siz,iyi sayılır,İzel toplantı sırasında burunsuz ve boyunsuz bir mumya fotoğrafı gösterdi.,burun,boyun,6887,0,4,-sIz
CO991001,84,5,X-ci-and-Y-ci,iyi sayılır,Ece yılbaşı için tablocu ve vazocu bir dükkana uğradı.,tablo,vazo,22400,0,4,-cI
CO991001,87,29,X-ci-and-Y-ci,iyi sayılır,Melis çocuk kitabı için ejderhacı ve perici bir illüstratörle çalıştı.,ejderha,peri,6920,0,4,-cI
CO991001,90,18,X-and-Y-siz,kötü,Nevzat genç bir stajyerken okul ve camisiz bir projeye destek verdi.,okul,cami,13071,1,2,-sIz
CO991001,93,23,X-lik-and-Y-lik,iyi sayılır,Jale geçen hafta çatallık ve bıçaklık bir dolap aldı.,çatal,bıçak,4637,0,4,-lIk
CO991001,96,13,X-ci-and-Y-ci,kötü sayılır,Emin geçen tatilde şehirci ve köycü bir yazarın kitabını okudu.,şehir,köy,7469,0,3,-cI
CO531213,2,31,X-and-Y-li,iyi,Tülay sonbahar koleksiyonu için gömlek ve pantolonlu bir kombin hazırladı.,gömlek,pantolon,2868,1,5,-lI
CO531213,5,2,X-lik-and-Y-lik,kötü,Ömer yeni evine masalık ve sandalyelik bir renk seçti.,masa,sandalye,1979,0,2,-lIk
CO531213,8,4,X-siz-and-Y-siz,oldukça iyi,Burak tatlı için limonsuz ve portakalsız bir tarif bulmuş.,limon,portakal,19036,0,6,-sIz
CO531213,11,17,X-and-Y-ci,kötü,Eylül kamp yaparken tepe ve nehirci bir rehberle doğa yürüyüşüne çıktı.,tepe,nehir,2223,1,2,-cI
CO531213,14,28,X-siz-and-Y-siz,kötü sayılır,Yasemin mezuniyetinden önce doktorsuz ve avukatsız bir mizansen canlandırdı.,avukat,doktor,1580,0,3,-sIz
CO531213,17,29,X-and-Y-siz,oldukça kötü,Melis çocuk kitabı için ejderha ve perisiz bir bölüm yazdı.,ejderha,peri,2060,1,1,-sIz
CO531213,20,10,X-lik-and-Y-lik,iyi,Ali yeni firmada kedilik ve köpeklik bir tasarım yaptı.,kedi,köpek,1542,0,5,-lIk
CO531213,23,16,X-ci-and-Y-ci,oldukça iyi,Okan üniversite yıllarında çiftlikçi ve fabrikacı bir yatırımcıyla görüştü.,çiftlik,fabrika,1533,0,6,-cI
CO531213,26,32,X-ci-and-Y-ci,kötü sayılır,Aydan restorasyon projesi için tabancı ve tavancı bir ustayla görüştü.,taban,tavan,66621,0,3,-cI
CO531213,29,24,X-ci-and-Y-ci,oldukça kötü,Neval ders çalışırken gözcü ve kulakçı bir doktorla konuştu.,göz,kulak,3477,0,1,-cI
CO531213,32,25,X-and-Y-ci,kötü sayılır,İzel toplantı sırasında burun ve boyuncu bir doktordan bahsetti.,burun,boyun,4260,1,3,-cI
CO531213,35,12,X-siz-and-Y-siz,iyi,Merve yeni hayatında evsiz ve bahçesiz bir şehir hayatı yaşıyor.,ev,bahçe,3749,0,5,-sIz
CO531213,38,9,X-and-Y-ci,oldukça iyi,Zeynep bu hafta anne ve babacı bir yeğeniyle ilgilendi.,anne,baba,4830,1,6,-cI
CO531213,41,13,X-and-Y-siz,kötü,Emin geçen tatilde şehir ve köysüz bir gezi yaptı.,şehir,köy,2652,1,2,-sIz
CO531213,44,11,X-and-Y-lik,kötü,Ahmet yabancı bir üniversitede bilim ve teknolojilik bir dergi çıkardı.,bilim,teknoloji,3428,1,2,-lIk
CO531213,47,15,X-and-Y-li,iyi sayılır,Deniz misafir beklerken sürahi ve bardaklı bir konsept hazırladı.,sürahi,bardak,3149,1,4,-lI
CO531213,50,19,X-and-Y-lik,kötü,Zühre son yolculukta gece ve gündüzlük bir program belirledi.,gece,gündüz,7805,1,2,-lIk
CO531213,53,5,X-and-Y-siz,iyi sayılır,Ece yılbaşı için tablo ve vazosuz bir masa seçti.,tablo,vazo,2109,1,4,-sIz
CO531213,56,22,X-li-and-Y-li,kötü,Yankı geçen yaz atlı ve balıklı bir tablo aldı.,at,balık,3277,0,2,-lI
CO531213,59,3,X-and-Y-lik,iyi,Leyla eski çarşıda atkı ve şapkalık bir askı beğenmiş.,atkı,şapka,2509,1,5,-lIk
CO531213,62,20,X-siz-and-Y-siz,oldukça kötü,Fehime düğünden önce büyükannesiz ve dedesiz bir aile hayatını irdeledi.,büyükanne,dede,4252,0,1,-sIz
CO531213,65,30,X-li-and-Y-li,kötü sayılır,Asuman dergi yazısı için düğünlü ve cenazeli bir belgesel izledi.,cenaze,düğün,2052,0,3,-lI
CO531213,68,1,X-and-Y-ci,oldukça kötü,Emel geçen haftasonu çorap ve ayakkabıcı bir adamla tanıştı.,çorap,ayakkabı,1748,1,1,-cI
CO531213,71,6,X-li-and-Y-li,oldukça kötü,Ali diyetteyken muzlu ve havuçlu bir kek yapardı.,muz,havuç,1933,0,1,-lI
CO531213,74,8,X-ci-and-Y-ci,iyi sayılır,Selin tamir için kapıcı ve pencereci bir marangozla anlaşmış.,kapı,pencere,2093,0,4,-cI
CO531213,77,7,X-and-Y-li,oldukça iyi,Dilek çeyiz alşverişi için battaniye ve halılı bir paket seçmiş.,battaniye,halı,2117,1,6,-lI
CO531213,80,14,X-li-and-Y-li,oldukça kötü,Elif küçük bir çocukken fareli ve aslanlı bir masal dinledi.,fare,aslan,1981,0,1,-lI
CO531213,83,18,X-lik-and-Y-lik,iyi sayılır,Nevzat genç bir stajyerken okulluk ve camilik bir alanın korunmasını önerdi.,okul,cami,1861,0,4,-lIk
CO531213,86,21,X-and-Y-siz,kötü,Mertcan dün akşam abi ve ablasız bir hayat düşündü.,abi,abla,2028,1,2,-sIz
CO531213,89,26,X-lik-and-Y-lik,kötü,Sinan gece yarısı hayaletlik ve canavarlık bir sahne tasarladı.,hayalet,canavar,2404,0,2,-lIk
CO531213,92,27,X-and-Y-lik,oldukça iyi,Baran araştırması için orman ve çöllük bir alan çizdi.,orman,çöl,1621,1,6,-lIk
CO531213,95,23,X-and-Y-li,kötü,Jale geçen hafta çatal ve bıçaklı bir masa kurdu.,çatal,bıçak,2037,1,2,-lI
CO289957,3,12,X-and-Y-lik,oldukça iyi,Merve aile mirasıyla ev ve bahçelik bir arsa satın aldı.,ev,bahçe,6045,1,6,-lIk
CO289957,6,2,X-and-Y-ci,iyi sayılır,Ömer yeni evine masa ve sandalyeci bir usta getirdi.,masa,sandalye,12998,1,4,-cI
CO289957,9,9,X-ci-and-Y-ci,kötü sayılır,Zeynep bu hafta anneci ve babacı bir yeğeniyle ilgilendi.,anne,baba,8068,0,3,-cI
CO289957,12,19,X-lik-and-Y-lik,kötü sayılır,Zühre son yolculukta gecelik ve gündüzlük bir program belirledi.,gece,gündüz,6638,0,3,-lIk
CO289957,15,23,X-li-and-Y-li,iyi,Jale geçen hafta çatallı ve bıçaklı bir masa kurdu.,çatal,bıçak,3237,0,5,-lI
CO289957,18,25,X-ci-and-Y-ci,kötü sayılır,İzel toplantı sırasında buruncu ve boyuncu bir doktordan bahsetti.,burun,boyun,6178,0,3,-cI
CO289957,21,8,X-and-Y-li,kötü sayılır,Selin tamir için kapı ve pencereli bir atölye tasarlamış.,kapı,pencere,11679,1,3,-lI
CO289957,24,27,X-lik-and-Y-lik,iyi sayılır,Baran araştırması için ormanlık ve çöllük bir alan çizdi.,orman,çöl,5468,0,4,-lIk
CO289957,27,28,X-and-Y-lik,kötü,Yasemin mezuniyetinden önce doktor ve avukatlık bir kimlik seçti.,avukat,doktor,5875,1,2,-lIk
CO289957,30,6,X-and-Y-siz,oldukça iyi,Ali diyetteyken muz ve havuçsuz bir kek yapardı.,muz,havuç,3319,1,6,-sIz
CO289957,33,10,X-and-Y-ci,iyi,Ali her hafta kedi ve köpekçi bir komşusuyla sohbet eder.,kedi,köpek,4948,1,5,-cI
CO289957,36,30,X-and-Y-siz,kötü,Asuman dergi yazısı için düğün ve cenazesiz bir program önerdi.,cenaze,düğün,6456,1,2,-sIz
CO289957,39,15,X-li-and-Y-li,oldukça iyi,Deniz misafir beklerken sürahili ve bardaklı bir konsept hazırladı.,sürahi,bardak,4393,0,6,-lI
CO289957,42,14,X-and-Y-siz,iyi sayılır,Elif gençlik yıllarında fare ve aslansız bir oyun sahneledi.,fare,aslan,8490,1,4,-sIz
CO289957,45,17,X-ci-and-Y-ci,kötü,Eylül kamp yaparken tepeci ve nehirci bir rehberle doğa yürüyüşüne çıktı.,tepe,nehir,4661,0,2,-cI
CO289957,48,7,X-li-and-Y-li,oldukça iyi,Dilek çeyiz alşverişi için battaniyeli ve halılı bir paket seçmiş.,battaniye,halı,5049,0,6,-lI
CO289957,51,32,X-and-Y-li,oldukça iyi,Aydan restorasyon projesi için taban ve tavanlı bir plan çizdi.,taban,tavan,6206,1,6,-lI
CO289957,54,3,X-lik-and-Y-lik,oldukça iyi,Leyla eski çarşıda atkılık ve şapkalık bir askı beğenmiş.,atkı,şapka,9589,0,6,-lIk
CO289957,57,16,X-and-Y-li,oldukça iyi,Okan üniversite yıllarında çiftlik ve fabrikalı bir işletme kurdu.,çiftlik,fabrika,3402,1,6,-lI
CO289957,60,22,X-and-Y-siz,oldukça kötü,Yankı geçen yaz at ve balıksız bir menü denedi.,at,balık,5890,1,1,-sIz
CO289957,63,11,X-lik-and-Y-lik,oldukça kötü,Ahmet yabancı bir üniversitede bilimlik ve teknolojilik bir dergi çıkardı.,bilim,teknoloji,3304,0,1,-lIk
CO289957,66,24,X-and-Y-li,oldukça kötü,Neval ders çalışırken göz ve kulaklı bir robot gördü.,göz,kulak,2848,1,1,-lI
CO289957,69,4,X-and-Y-lik,oldukça kötü,Burak tatlı için limon ve portakallık bir tabak hazırlamış.,limon,portakal,3806,1,1,-lIk
CO289957,72,5,X-siz-and-Y-siz,oldukça iyi,Ece yılbaşı için tablosuz ve vazosuz bir masa seçti.,tablo,vazo,6381,0,6,-sIz
CO289957,75,21,X-siz-and-Y-siz,oldukça iyi,Mertcan dün akşam abisiz ve ablasız bir hayat düşündü.,abi,abla,4613,0,6,-sIz
CO289957,78,13,X-siz-and-Y-siz,iyi sayılır,Emin geçen tatilde şehirsiz ve köysüz bir gezi yaptı.,şehir,köy,7049,0,4,-sIz
CO289957,81,31,X-li-and-Y-li,oldukça iyi,Tülay sonbahar koleksiyonu için gömlekli ve pantolonlu bir kombin hazırladı.,gömlek,pantolon,4717,0,6,-lI
CO289957,84,1,X-ci-and-Y-ci,iyi,Emel geçen haftasonu çorapçı ve ayakkabıcı bir adamla tanıştı.,çorap,ayakkabı,7164,0,5,-cI
CO289957,87,29,X-siz-and-Y-siz,iyi,Melis çocuk kitabı için ejderhasız ve perisiz bir bölüm yazdı.,ejderha,peri,8469,0,5,-sIz
CO289957,90,26,X-and-Y-ci,iyi sayılır,Sinan gece yarısı hayalet ve canavarcı bir yazarla röportaj yaptı.,hayalet,canavar,5796,1,4,-cI
CO289957,93,18,X-and-Y-ci,iyi sayılır,Nevzat genç bir stajyerken okul ve camici bir mimarın eserlerini inceledi.,okul,cami,10353,1,4,-cI
CO289957,96,20,X-and-Y-lik,iyi sayılır,Fehime düğünden önce büyükanne ve dedelik ilişkisi üzerine bir roman okudu.,büyükanne,dede,8001,1,4,-lIk
CO383794,3,9,X-and-Y-li,iyi sayılır,Zeynep bu hafta anne ve babalı bir toplantıya katıldı.,anne,baba,5775,1,4,-lI
CO383794,6,7,X-and-Y-siz,iyi,Dilek çeyiz alşverişi için battaniye ve halısız bir paket seçmiş.,battaniye,halı,12855,1,5,-sIz
CO383794,9,22,X-siz-and-Y-siz,oldukça kötü,Yankı geçen yaz atsız ve balıksız bir menü denedi.,at,balık,12093,0,1,-sIz
CO383794,12,10,X-ci-and-Y-ci,kötü,Ali her hafta kedici ve köpekçi bir komşusuyla sohbet eder.,kedi,köpek,8843,0,2,-cI
CO383794,15,31,X-and-Y-siz,iyi,Tülay sonbahar koleksiyonu için gömlek ve pantolonsuz bir katalog inceledi.,gömlek,pantolon,9223,1,5,-sIz
CO383794,18,2,X-ci-and-Y-ci,iyi sayılır,Ömer yeni evine masacı ve sandalyeci bir usta getirdi.,masa,sandalye,4484,0,4,-cI
CO383794,21,13,X-and-Y-lik,iyi sayılır,Emin geçen tatilde şehir ve köylük bir bölgeyi gezdi.,şehir,köy,9723,1,4,-lIk
